{
 "schema_version": "1.0",
 "content_id": "ws-asset-testz-fixture",
 "generated_at": "2026-07-14T12:00:00+08:00",
 "data_as_of": "2026-07-14",
 "status": "HERMES_READY",
 "freshness": { "state": "FRESH", "max_age_days": 7, "age_days": 0 },
 "verification": {
  "hermes": { "result": "PASS", "at": "2026-07-14T12:00:00+08:00" },
  "codex": { "result": "PENDING", "at": null }
 },
 "sources": [
  { "name": "Fixture source A", "url": "https://example.com/fixture-a" },
  { "name": "Fixture source B", "url": "https://example.com/fixture-b" }
 ],
 "compliance": "WATCHLIST_ONLY",
 "payload": {
  "ticker": "TESTZ",
  "name": "E2E Fixture Asset (not a real security)",
  "sector": "Test fixture",
  "narrative": "This is an end-to-end pipeline fixture used to prove the Hermes -> Codex -> CI -> Preview flow without touching production data. It is research-context only and is never published to Production. Nothing here is a recommendation.",
  "catalysts": ["Pipeline rehearsal marker only"],
  "observations": [
   { "label": "Fixture marker", "value": "E2E rehearsal 2026-07-14", "verified_by": "fixture" }
  ]
 }
}
