{
    "schema_version": "1.0",
    "content_id": "ws-asset-rklb",
    "generated_at": "2026-07-14T23:02:42+08:00",
    "data_as_of": "2026-07-14",
    "status": "HERMES_READY",
    "freshness": {
        "state": "FRESH",
        "max_age_days": 7,
        "age_days": 0
    },
    "verification": {
        "hermes": {
            "result": "PASS",
            "at": "2026-07-14T23:02:42+08:00"
        },
        "codex": {
            "result": "PENDING",
            "at": null
        }
    },
    "sources": [
        {
            "name": "Finnhub — RKLB",
            "url": "https://finnhub.io/quote/RKLB"
        },
        {
            "name": "Yahoo Finance — RKLB",
            "url": "https://finance.yahoo.com/quote/RKLB"
        }
    ],
    "compliance": "WATCHLIST_ONLY",
    "payload": {
        "ticker": "RKLB",
        "name": "Rocket Lab USA, Inc.",
        "sector": "Aerospace / Space launch",
        "narrative": "Rocket Lab sits in the B-group watchlist as the reference name for small-lift space launch and satellite systems. The workspace tracks it as a research subject only: what the dual-engine pipeline observed over the last 5 trading days, which catalysts are on the calendar, and where the primary data sources disagree. Nothing here is a recommendation to buy, sell, or hold.",
        "catalysts": [
            "Neutron rocket development milestones and test schedule",
            "Space Systems / satellite component contract pipeline",
            "Quarterly earnings and launch cadence updates"
        ],
        "observations": [
            {
                "label": "5-day change (research window)",
                "value": "-4.3%",
                "verified_by": "Finnhub + Yahoo"
            },
            {
                "label": "Closing price (as-of date)",
                "value": "$79.75",
                "verified_by": "Finnhub + Yahoo"
            },
            {
                "label": "Coverage group",
                "value": "B-group US equities watchlist",
                "verified_by": "internal watchlist config"
            },
            {
                "label": "Verification tolerance",
                "value": "1.5% cross-source; mismatch -> DATA_UNAVAILABLE",
                "verified_by": "dual-engine protocol"
            }
        ]
    }
}