{
  "schema_version": "1.0",
  "content_id": "ws-asset-rklb",
  "generated_at": "2026-07-14T14:02:24.949539+08:00",
  "data_as_of": "2026-07-13",
  "status": "HERMES_READY",
  "freshness": {
    "state": "FRESH",
    "max_age_days": 7,
    "age_days": 1
  },
  "verification": {
    "hermes": {
      "result": "PASS",
      "at": "2026-07-14T14:02:24.949572+08:00"
    },
    "codex": {
      "result": "PENDING",
      "at": null
    }
  },
  "sources": [
    {
      "name": "Yahoo Finance — RKLB",
      "url": "https://finance.yahoo.com/quote/RKLB"
    },
    {
      "name": "Nasdaq — RKLB",
      "url": "https://www.nasdaq.com/market-activity/stocks/rklb"
    }
  ],
  "compliance": "WATCHLIST_ONLY",
  "payload": {
    "ticker": "RKLB",
    "name": "Rocket Lab USA, Inc.",
    "sector": "Aerospace / Space Launch",
    "narrative": "Rocket Lab USA (RKLB) is an end-to-end space company that designs, manufactures, and launches orbital rockets — primarily the small-lift Electron vehicle and the HASTE suborbital/hypersonic test platform — while also building spacecraft and satellite components through its Space Systems division. The company is developing the medium-lift Neutron rocket (debut targeted for late 2026), which would significantly expand its addressable market into commercial constellation launches, national security missions, and potentially point-to-point cargo delivery. RKLB sits on the watchlist as the most operationally proven pure-play in public space infrastructure, with a growing $2.2 billion backlog, over 75 Electron missions flown, and a clear near-term catalyst in Neutron's inaugural flight — a milestone that would determine whether Rocket Lab transitions from a niche small-launch provider to a full-spectrum competitor against incumbents like SpaceX.\n\nAll content is for educational and research purposes only. WATCHLIST_ONLY — no positions, no trade execution.",
    "catalysts": [
      "Quarterly earnings and forward guidance cadence",
      "Sector-specific demand cycle and supply-chain signals",
      "Macro regime shifts affecting risk appetite"
    ],
    "observations": [
      {
        "label": "Latest close (verified)",
        "value": "$76.73",
        "verified_by": "finnhub + yahoo"
      },
      {
        "label": "Coverage group",
        "value": "B-group US equities watchlist",
        "verified_by": "internal watchlist config"
      },
      {
        "label": "Verification tolerance",
        "value": "1.5% cross-source; mismatch -> DATA_UNAVAILABLE",
        "verified_by": "dual-engine protocol"
      }
    ]
  }
}