{
  "schema_version": "1.0",
  "content_id": "ws-asset-spcx",
  "generated_at": "2026-07-14T14:26:58.071940+08:00",
  "data_as_of": "2026-07-13",
  "status": "HERMES_READY",
  "freshness": {
    "state": "FRESH",
    "max_age_days": 7,
    "age_days": 1
  },
  "verification": {
    "hermes": {
      "result": "PASS",
      "at": "2026-07-14T14:26:58.071973+08:00"
    },
    "codex": {
      "result": "PENDING",
      "at": null
    }
  },
  "sources": [
    {
      "name": "Yahoo Finance — SPCX",
      "url": "https://finance.yahoo.com/quote/SPCX"
    },
    {
      "name": "Nasdaq — SPCX",
      "url": "https://www.nasdaq.com/market-activity/stocks/spcx"
    }
  ],
  "compliance": "WATCHLIST_ONLY",
  "payload": {
    "ticker": "SPCX",
    "name": "SPACEX (proxy via SPCX)",
    "sector": "Space Economy Proxy",
    "narrative": "SPCX is the publicly listed ticker for Space Exploration Technologies Corp. (SpaceX), which completed its IPO in June 2026 at an approximately $1.75 trillion valuation — the largest IPO on record. The company is a vertically integrated space, connectivity, and AI enterprise: it designs and launches reusable rockets and spacecraft (Falcon, Starship), operates the Starlink satellite broadband constellation, and, following its acquisition of xAI in February 2026, develops frontier AI models (Grok) and runs the X social platform.\n\nIt sits on the watchlist as a space economy proxy because no other single listed entity combines launch services, satellite internet infrastructure, and frontier AI under one roof — making it a unique bellwether for the convergence of aerospace, telecom, and artificial intelligence. Its extreme concentration (one company spanning three sectors) and post-IPO price discovery phase warrant close observation of operational milestones — Starship cadence, Starlink revenue scale, and AI integration progress — rather than near-term trading setups.",
    "catalysts": [
      "Quarterly earnings and forward guidance cadence",
      "Sector-specific demand cycle and supply-chain signals",
      "Macro regime shifts affecting risk appetite"
    ],
    "observations": [
      {
        "label": "Latest close (verified)",
        "value": "$139.14",
        "verified_by": "finnhub + yahoo"
      },
      {
        "label": "Coverage group",
        "value": "B-group US equities watchlist",
        "verified_by": "internal watchlist config"
      },
      {
        "label": "Verification tolerance",
        "value": "1.5% cross-source; mismatch -> DATA_UNAVAILABLE",
        "verified_by": "dual-engine protocol"
      }
    ]
  }
}