{
    "schema_version": "1.0",
    "content_id": "ws-asset-nvda",
    "generated_at": "2026-07-14T23:02:42+08:00",
    "data_as_of": "2026-07-14",
    "status": "HERMES_READY",
    "freshness": {
        "state": "FRESH",
        "max_age_days": 7,
        "age_days": 0
    },
    "verification": {
        "hermes": {
            "result": "PASS",
            "at": "2026-07-14T23:02:42+08:00"
        },
        "codex": {
            "result": "PENDING",
            "at": null
        }
    },
    "sources": [
        {
            "name": "Finnhub — NVDA",
            "url": "https://finnhub.io/quote/NVDA"
        },
        {
            "name": "Yahoo Finance — NVDA",
            "url": "https://finance.yahoo.com/quote/NVDA"
        }
    ],
    "compliance": "WATCHLIST_ONLY",
    "payload": {
        "ticker": "NVDA",
        "name": "NVIDIA Corporation",
        "sector": "Semiconductors / AI accelerators",
        "narrative": "NVIDIA sits at the center of the B-group watchlist as the reference name for AI-accelerator demand. The workspace tracks it as a research subject only: what the dual-engine pipeline observed over the last 5 trading days, which catalysts are on the calendar, and where the primary data sources disagree. Nothing here is a recommendation to buy, sell, or hold.",
        "catalysts": [
            "Data-center GPU demand cycle and hyperscaler capex commentary",
            "Quarterly earnings and forward guidance cadence",
            "Supply-chain / foundry capacity signals (research-context only)"
        ],
        "observations": [
            {
                "label": "5-day change (research window)",
                "value": "+1.4%",
                "verified_by": "Finnhub + Yahoo"
            },
            {
                "label": "Closing price (as-of date)",
                "value": "$207.01",
                "verified_by": "Finnhub + Yahoo"
            },
            {
                "label": "Coverage group",
                "value": "B-group US equities watchlist",
                "verified_by": "internal watchlist config"
            },
            {
                "label": "Verification tolerance",
                "value": "1.5% cross-source; mismatch -> DATA_UNAVAILABLE",
                "verified_by": "dual-engine protocol"
            }
        ]
    }
}